{"pack_version":1,"pack_type":"tos_zarathustra_route_retrieval_pack","source_manifest_ref":"manifests/tos_zarathustra_route_retrieval_pack.json","source_inputs":[{"name":"tos_zarathustra_route_pack","repo":"aoa-kag","role":"route_pack","ref":"generated/tos_zarathustra_route_pack.min.json"}],"surface_bindings":[{"surface_id":"AOA-K-0011","surface_name":"tos-zarathustra-route-retrieval-surface","derived_kind":"retrieval_surface","derived_slot":"routes","source_input":"tos_zarathustra_route_pack"}],"surface_id":"AOA-K-0011","surface_name":"tos-zarathustra-route-retrieval-surface","adjunct_budget":{"max_adjunct_surfaces":1,"max_route_families":1,"numbered_tiny_path_inclusion":"forbidden","default_activation":"opt_in_only"},"subordinate_posture":{"adjunct_role":"standalone_handles_only","entry_order":"source_owned_tiny_entry_before_adjunct","source_first_reentry_ref":"Tree-of-Sophia/ToS/public-compatibility/tos_tiny_entry_route.example.json","routing_ownership":"forbidden","canon_authorship":"forbidden"},"route_count":1,"routes":[{"retrieval_id":"AOA-K-0011::thus-spoke-zarathustra/prologue-1","route_id":"thus-spoke-zarathustra/prologue-1","route_pack_ref":"generated/tos_zarathustra_route_pack.min.json","route_capsule_ref":"Tree-of-Sophia/ToS/zarathustra/prologue-1/TRILINGUAL_ENTRY.md","relation_pack_ref":"Tree-of-Sophia/ToS/canon/relations/friedrich-nietzsche/thus-spoke-zarathustra/prologue-1/edges.csv","node_type_counts":{"source":1,"concept":2,"principle":13,"lineage":1,"event":18,"state":9,"support":46,"analogy":1,"synthesis":1},"edge_kind_counts":{"source_edge":92,"bridge_edge":11,"principle_edge":22},"source_handles":[{"node_id":"tos.source.thus-spoke-zarathustra.prologue","authority_ref":"Tree-of-Sophia/ToS/canon/source/friedrich-nietzsche/thus-spoke-zarathustra/prologue-1/node.json"}],"concept_handles":[{"node_id":"tos.concept.becoming","authority_ref":"Tree-of-Sophia/ToS/canon/concept/becoming/node.json"},{"node_id":"tos.concept.overcoming","authority_ref":"Tree-of-Sophia/ToS/canon/concept/overcoming/node.json"}],"principle_handles":[{"node_id":"tos.principle.thus-spoke-zarathustra.prologue.beginning-through-going-under","authority_ref":"Tree-of-Sophia/ToS/canon/principle/friedrich-nietzsche/thus-spoke-zarathustra/prologue-1/beginning-through-going-under/node.json"},{"node_id":"tos.principle.thus-spoke-zarathustra.prologue.blessing-is-reciprocal","authority_ref":"Tree-of-Sophia/ToS/canon/principle/friedrich-nietzsche/thus-spoke-zarathustra/prologue-1/blessing-is-reciprocal/node.json"},{"node_id":"tos.principle.thus-spoke-zarathustra.prologue.descent-is-required-by-gift","authority_ref":"Tree-of-Sophia/ToS/canon/principle/friedrich-nietzsche/thus-spoke-zarathustra/prologue-1/descent-is-required-by-gift/node.json"},{"node_id":"tos.principle.thus-spoke-zarathustra.prologue.excess-seeks-recipients","authority_ref":"Tree-of-Sophia/ToS/canon/principle/friedrich-nietzsche/thus-spoke-zarathustra/prologue-1/excess-seeks-recipients/node.json"},{"node_id":"tos.principle.thus-spoke-zarathustra.prologue.gift-has-dual-mode","authority_ref":"Tree-of-Sophia/ToS/canon/principle/friedrich-nietzsche/thus-spoke-zarathustra/prologue-1/gift-has-dual-mode/node.json"},{"node_id":"tos.principle.thus-spoke-zarathustra.prologue.go-under-is-human-name","authority_ref":"Tree-of-Sophia/ToS/canon/principle/friedrich-nietzsche/thus-spoke-zarathustra/prologue-1/go-under-is-human-name/node.json"},{"node_id":"tos.principle.thus-spoke-zarathustra.prologue.happiness-is-relational","authority_ref":"Tree-of-Sophia/ToS/canon/principle/friedrich-nietzsche/thus-spoke-zarathustra/prologue-1/happiness-is-relational/node.json"},{"node_id":"tos.principle.thus-spoke-zarathustra.prologue.overflow-can-be-received","authority_ref":"Tree-of-Sophia/ToS/canon/principle/friedrich-nietzsche/thus-spoke-zarathustra/prologue-1/overflow-can-be-received/node.json"},{"node_id":"tos.principle.thus-spoke-zarathustra.prologue.reflected-light-can-be-carried","authority_ref":"Tree-of-Sophia/ToS/canon/principle/friedrich-nietzsche/thus-spoke-zarathustra/prologue-1/reflected-light-can-be-carried/node.json"},{"node_id":"tos.principle.thus-spoke-zarathustra.prologue.return-as-action","authority_ref":"Tree-of-Sophia/ToS/canon/principle/friedrich-nietzsche/thus-spoke-zarathustra/prologue-1/return-as-action/node.json"},{"node_id":"tos.principle.thus-spoke-zarathustra.prologue.solitude-as-ripening","authority_ref":"Tree-of-Sophia/ToS/canon/principle/friedrich-nietzsche/thus-spoke-zarathustra/prologue-1/solitude-as-ripening/node.json"},{"node_id":"tos.principle.thus-spoke-zarathustra.prologue.tranquil-vision-without-envy","authority_ref":"Tree-of-Sophia/ToS/canon/principle/friedrich-nietzsche/thus-spoke-zarathustra/prologue-1/tranquil-vision-without-envy/node.json"},{"node_id":"tos.principle.thus-spoke-zarathustra.prologue.wisdom-can-overfill","authority_ref":"Tree-of-Sophia/ToS/canon/principle/friedrich-nietzsche/thus-spoke-zarathustra/prologue-1/wisdom-can-overfill/node.json"}],"lineage_handles":[{"node_id":"tos.lineage.thus-spoke-zarathustra.prologue.becoming-to-overcoming","authority_ref":"Tree-of-Sophia/ToS/canon/lineage/friedrich-nietzsche/thus-spoke-zarathustra/prologue-1/becoming-to-overcoming/node.json"}],"event_handles":[{"node_id":"tos.event.thus-spoke-zarathustra.prologue.beginning-of-zarathustra-going-under","authority_ref":"Tree-of-Sophia/ToS/canon/event/friedrich-nietzsche/thus-spoke-zarathustra/prologue-1/beginning-of-zarathustra-going-under/node.json"},{"node_id":"tos.event.thus-spoke-zarathustra.prologue.bestow-and-distribute","authority_ref":"Tree-of-Sophia/ToS/canon/event/friedrich-nietzsche/thus-spoke-zarathustra/prologue-1/bestow-and-distribute/node.json"},{"node_id":"tos.event.thus-spoke-zarathustra.prologue.bless-sun-for-overflow","authority_ref":"Tree-of-Sophia/ToS/canon/event/friedrich-nietzsche/thus-spoke-zarathustra/prologue-1/bless-sun-for-overflow/node.json"},{"node_id":"tos.event.thus-spoke-zarathustra.prologue.dawn-address-to-sun","authority_ref":"Tree-of-Sophia/ToS/canon/event/friedrich-nietzsche/thus-spoke-zarathustra/prologue-1/dawn-address-to-sun/node.json"},{"node_id":"tos.event.thus-spoke-zarathustra.prologue.departure-from-origin","authority_ref":"Tree-of-Sophia/ToS/canon/event/friedrich-nietzsche/thus-spoke-zarathustra/prologue-1/departure-from-origin/node.json"},{"node_id":"tos.event.thus-spoke-zarathustra.prologue.descend-into-depth","authority_ref":"Tree-of-Sophia/ToS/canon/event/friedrich-nietzsche/thus-spoke-zarathustra/prologue-1/descend-into-depth/node.json"},{"node_id":"tos.event.thus-spoke-zarathustra.prologue.descent-named-as-go-under","authority_ref":"Tree-of-Sophia/ToS/canon/event/friedrich-nietzsche/thus-spoke-zarathustra/prologue-1/descent-named-as-go-under/node.json"},{"node_id":"tos.event.thus-spoke-zarathustra.prologue.go-under-to-humans","authority_ref":"Tree-of-Sophia/ToS/canon/event/friedrich-nietzsche/thus-spoke-zarathustra/prologue-1/go-under-to-humans/node.json"},{"node_id":"tos.event.thus-spoke-zarathustra.prologue.golden-water-flows","authority_ref":"Tree-of-Sophia/ToS/canon/event/friedrich-nietzsche/thus-spoke-zarathustra/prologue-1/golden-water-flows/node.json"},{"node_id":"tos.event.thus-spoke-zarathustra.prologue.heart-transformation","authority_ref":"Tree-of-Sophia/ToS/canon/event/friedrich-nietzsche/thus-spoke-zarathustra/prologue-1/heart-transformation/node.json"},{"node_id":"tos.event.thus-spoke-zarathustra.prologue.morning-wait-for-sun","authority_ref":"Tree-of-Sophia/ToS/canon/event/friedrich-nietzsche/thus-spoke-zarathustra/prologue-1/morning-wait-for-sun/node.json"},{"node_id":"tos.event.thus-spoke-zarathustra.prologue.need-hands-for-giving","authority_ref":"Tree-of-Sophia/ToS/canon/event/friedrich-nietzsche/thus-spoke-zarathustra/prologue-1/need-hands-for-giving/node.json"},{"node_id":"tos.event.thus-spoke-zarathustra.prologue.receive-overflow-from-sun","authority_ref":"Tree-of-Sophia/ToS/canon/event/friedrich-nietzsche/thus-spoke-zarathustra/prologue-1/receive-overflow-from-sun/node.json"},{"node_id":"tos.event.thus-spoke-zarathustra.prologue.reflection-of-bliss-is-carried","authority_ref":"Tree-of-Sophia/ToS/canon/event/friedrich-nietzsche/thus-spoke-zarathustra/prologue-1/reflection-of-bliss-is-carried/node.json"},{"node_id":"tos.event.thus-spoke-zarathustra.prologue.request-blessing-from-tranquil-eye","authority_ref":"Tree-of-Sophia/ToS/canon/event/friedrich-nietzsche/thus-spoke-zarathustra/prologue-1/request-blessing-from-tranquil-eye/node.json"},{"node_id":"tos.event.thus-spoke-zarathustra.prologue.request-blessing-of-cup","authority_ref":"Tree-of-Sophia/ToS/canon/event/friedrich-nietzsche/thus-spoke-zarathustra/prologue-1/request-blessing-of-cup/node.json"},{"node_id":"tos.event.thus-spoke-zarathustra.prologue.sun-ascends-to-cave-10y","authority_ref":"Tree-of-Sophia/ToS/canon/event/friedrich-nietzsche/thus-spoke-zarathustra/prologue-1/sun-ascends-to-cave-10y/node.json"},{"node_id":"tos.event.thus-spoke-zarathustra.prologue.sun-evening-underworld-light","authority_ref":"Tree-of-Sophia/ToS/canon/event/friedrich-nietzsche/thus-spoke-zarathustra/prologue-1/sun-evening-underworld-light/node.json"}],"state_handles":[{"node_id":"tos.state.thus-spoke-zarathustra.prologue.cup-wants-to-empty-again","authority_ref":"Tree-of-Sophia/ToS/canon/state/friedrich-nietzsche/thus-spoke-zarathustra/prologue-1/cup-wants-to-empty-again/node.json"},{"node_id":"tos.state.thus-spoke-zarathustra.prologue.cup-wants-to-overflow","authority_ref":"Tree-of-Sophia/ToS/canon/state/friedrich-nietzsche/thus-spoke-zarathustra/prologue-1/cup-wants-to-overflow/node.json"},{"node_id":"tos.state.thus-spoke-zarathustra.prologue.overfull-wisdom","authority_ref":"Tree-of-Sophia/ToS/canon/state/friedrich-nietzsche/thus-spoke-zarathustra/prologue-1/overfull-wisdom/node.json"},{"node_id":"tos.state.thus-spoke-zarathustra.prologue.revaluation-of-joy","authority_ref":"Tree-of-Sophia/ToS/canon/state/friedrich-nietzsche/thus-spoke-zarathustra/pro